{
  "id": "naturaleza_plantas_huerto_01",
  "file": "naturaleza/plantas_huerto_01.jpg",
  "master": "masters/naturaleza_plantas_huerto_01.png",
  "title": "Leo y Luna cuidan un pequeño huerto",
  "category": "naturaleza",
  "subcategory": "plantas",
  "characters": ["leo", "luna"],
  "concepts": ["plantas", "semillas", "huerto", "crecimiento", "naturaleza", "cuidado"],
  "actions": ["plantar", "regar", "cuidar"],
  "objects": ["semilla", "maceta", "regadera", "brote"],
  "contexts": ["proyecto", "plan_anual", "portada", "ciencia", "ambiente"],
  "age_range": [3, 4, 5],
  "orientation": "landscape",
  "aspect_ratio": "3:2",
  "has_text": false,
  "country_context": "PE",
  "variant": 1,
  "priority": 10
}
