{
  "id": "escuela_organizar_materiales_01",
  "file": "escuela/escuela_organizar_materiales_01.jpg",
  "master": "masters/escuela_organizar_materiales_01.png",
  "title": "Niños organizan materiales del aula",
  "category": "escuela",
  "subcategory": "materiales",
  "characters": [
    "leo",
    "sofia"
  ],
  "concepts": [
    "escuela",
    "orden",
    "materiales"
  ],
  "actions": [
    "organizar",
    "guardar"
  ],
  "objects": [
    "bloques",
    "libros",
    "estantes"
  ],
  "contexts": [
    "proyecto",
    "plan_anual",
    "portada",
    "escuela",
    "materiales"
  ],
  "age_range": [
    3,
    4,
    5
  ],
  "orientation": "landscape",
  "aspect_ratio": "3:2",
  "has_text": false,
  "country_context": "PE",
  "variant": 1,
  "priority": 10
}
